nom,type,description,commentaire,fichier_image
Pioche verrouillée !,normale,"l DRE RAR RPC PR EE ACER RES GE SE CE UE a Pioche verrouillée ! Jouez cette carte face visible devant vous. La pioche est maintenant bloquée et personne ne peut y prendre de cartes. Si un joueur n’a pas de carte à jouer à son tour, il est éliminé. « Et si j'ai une carte qui me _ permet de piocher ? — Ju peux l'oublier. »",,normale/pioche-verrouillee-01.jpg
Pluie de flèches,normale,"A _ rluie de flèches _ Placez cette carte devant un autre joueur. Si cette carte est devant vous à la fin de votre tour, mille flèches vous transpercent. Vous êtes éliminé. Ca va piquer un peu. ”",,normale/pluie-de-fleches-01.jpg
Points,normale,IR Points Placez cette carte face visible devant vous. Elle vaut +8 points. Le premier joueur qui atteint 15 points gagne la partie. EEE EEE Cette carte vaut +1 000 points si _ vous êtes une machine.,variante flavor text 'machine' — famille de cartes +8 points (voir aussi Points variantes Nobel/avion de chasse),normale/points-01.jpg
Points,normale,"RS Placez cette carte face visible devant vous. Elle vaut +8 points. Le premier joueur qui atteint 15 points gagne la partie. SI VOUS parvenez à cumuler 6 999 992 points, demandez un avion de chasse. M À",variante flavor text 'avion de chasse',normale/points-02.jpg
Points,normale,ne Placez cette carte face visible devant vous. Elle vaut +8 points. Le premier joueur qui atteint 15 points gagne la partie. Cette carte vaut +1 000 points si vous avez déjà gagné un prix Nobel. nn,variante flavor text 'prix Nobel',normale/points-03.jpg
Politique,normale,"Lancez cette carte sur la table et criez « OH NON ! » Tout est foutu. Tous les joueurs remélangent leur main dans la pioche, puis ils tirent 2 cartes de celle-ci. Rejouez un tour, puis défaussez cette carte. Cette carte ne profitera qu'à une faible partie des joueurs, d'où son nom. sai",titre confirmé visuellement par l'utilisateur,normale/politique-01.jpg
Rire démoniaque,normale,"A ._ Rire démoniaque Placez cette carte devant VOUS. Chaque fois qu’un joueur se fait éliminer, riez méchamment et piochez 1 carte. Si vous gagnez la partie, vous pouvez commencer à dominer le monde.* ———.…—... “Robots laser non inclus. Conserver la notice pour référence ultérieure. 4",,normale/rire-demoniaque-01.jpg
Réforme des retraites,normale,"Li a Réforme des _ retraites Placez cette carte devant un autre joueur. _ Vous ne jouez plus pendant deux tours (eeeeh oui, vous vous prenez deux ans de travail en plus ). /ravailler plus pour gagner plus, qu'ils disaient...",,normale/reforme-des-retraites-01.jpg
Science,normale,"TS S'il y a une carte Dragon ou Trou noir devant vous, vous n y croyez pas ! Déplacez-la devant un autre joueur. Sinon, piochez 2 cartes et confortez-vous dans votre connaissance supérieure. Sije n'y crois pas, c'est que ça n'existe pas. ”",titre confirmé visuellement par l'utilisateur,normale/science-01.jpg
Super Points,normale,"_ Super Points Placez cette carte face visible devant vous. Éllevaut +90 points. Sauf que maintenant, il faut 100 points pour gagner. Voilà, faut toujours qu'il y ait quelqu'un pour tout gâcher, {u avais besoin de tes 90 points, c'est ça ?",,normale/super-points-01.jpg
Supervitesse,normale,"Supervitesse S'il y a une carte Laser ou Pluie de flèches devant vous, vous l'esquivez Déplacez-la devant un autre joueur. Sinon, piochez 2 cartes, très très vite. Monsieur et Madame Ervitte-Monslippe ont un fils, Jean-Philippe. a Fr",,normale/supervitesse-01.jpg
Titre de noblesse,normale,"Titre de noblesse Posez cette carte devant VOUS. À partir de maintenant, tous les joueurs doivent vous vouvoyer. : Si Un joueur vous tutoie, ilest éliminé. a ———————— Je ne te permets pas de me vouvoyer ! Enfin, je ne te permets pas de me tutoyer !",,normale/titre-de-noblesse-01.jpg
Toi,normale,"TT LL Toi Placez cette carte face visible devant vous et lisez a voix haute : « Quiconque prononce les mots “tu/toi/t”, “ton/ta”, ou ‘le tien/la tienne” sera immédiatement éliminé, à partir de... maintenant. » Bonne chance ! :D « J'ai vu le couvreur, il m'a parlé de toits. — T'as perdu ! = 4,1 À _d",famille 'pronom interdit' avec Moi / Ils-Elles — interdit tu/toi/ton/ta,normale/toi-01.jpg
Trou noir,normale,"Placez cette carte devant un autre joueur. Si cette carte est devant vous à la fin de votre tour, un trou noir vous aspire. Vous êtes éliminé. Son absence à créé un grand vide. ff",titre confirmé visuellement par l'utilisateur,normale/trou-noir-01.jpg
Vaisseau spatial,normale,"Vaisseau spatial Sil y a une carte Laser ou Trou noir devant vous, vous vous échappez Déplacez-la devant un autre joueur. Sinon, piochez 2 cartes } en faisant le bruit d’un vaisseau spatial. Vionnnnnn piou piou piouuuuuu !",,normale/vaisseau-spatial-01.jpg
Vous avez gagné !,normale,"7 Vous avez gagné ! Vous gagnez la partie sl vous jouez cette carte... et que vous êtes la personne de plus petite taille encore en jeu. Sinon, vous pouvez la placer face visible pour marquer +5 points. Le premier joueur qui atteint 15 points gagne la partie. Si vous n'êtes pas la personne de plus petite taille, faites donc enrager cette personne en agitant la carte au-dessus de sa tête. .",variante condition: être la personne de plus petite taille en jeu,normale/vous-avez-gagne-01.jpg
Vous avez gagné !,normale,"Vous avez gagne ! Vous gagnez la partie sl vous jouez cette carte. et que cest le mois de votre anniversaire. Sinon, vous pouvez la placer face visible pour marquer +5 points. Le premier joueur qui atteint 15 points gagne la partie. Personne n’a testé ce truc ? est un cadeau parfait. Sic'’est votre anniversaire et que ce jeu n'est pas à vous, vous pouvez demander qu'on vous l'offre, là, tout de suite. k, e",variante condition: mois d'anniversaire,normale/vous-avez-gagne-02.jpg
Vous avez gagné !,normale,"4 Vous avez gagné ! Vous gagnez la partie si vous jouez cette carte... et que tous les autres joueurs sont des hommes et vous non. Sinon, vous pouvez la placer face visible pour marquer +5 points. Le premier joueur qui atteint 15 points gagne la partie. Évidemment, c'est mieux d'être non binaire. Sinon, vous n'êtes qu'une suite de 1 et de 0. si",variante condition: tous les autres joueurs sont des hommes et vous non,normale/vous-avez-gagne-03.jpg
Vous avez gagné !,normale,"Vous avez gagné ! Vous gagnez la partie SI vous jouez cette carte... et qu'il y a au moins 3 bombes face visible. Sinon, vous pouvez la placer _ face visible pour marquer +5 points. Le premier joueur qui atteint 15 points gagne la partie. Si vous jouez avec des mannequins, ça ne compte pas. n",variante condition: au moins 3 bombes face visible,normale/vous-avez-gagne-04.jpg
Vous avez gagné !,normale,"Vous avez gagné ! Vous gagnez la partie si vous jouez cette carte. et que tous les joueurs encore en jeu portent du bleu (visible). Sinon, vous pouvez la placer face visible pour marquer +5 points. Le premier joueur qui atteint 15 points gagne la partie. me Cela a pris des dizaines d'années de recherche, mais il est maintenant prouvé que le _ bleu est la meilleure couleur. L À",variante condition: tous les joueurs en jeu portent du bleu visible,normale/vous-avez-gagne-05.jpg
Vous avez gagné !,normale,"Vous avez gagne ! Vous gagnez la partie si vous jouez cette carte... et que personne n'a de carte Etoile en main. Sinon, vous pouvez la placer face visible pour marquer +5 points … Le premier joueur qui atteint 15 points gagne la partie. En inclinant cette carte juste comme il faut, vous activerez son pouvoir magique.",variante condition: personne n'a de carte Étoile en main,normale/vous-avez-gagne-06.jpg
Zombies,normale,"Jouez cette carte face visible devant vous. Si un joueur oublie de dire « AAAH ! Des zombies ! » a son tour, les zombies 1 dévorent sa cervelle et il est éliminé. Sauf s'il a une banane. Les bananes sont les prédateurs naturels des zombies. à. ï",titre confirmé visuellement par l'utilisateur,normale/zombies-01.jpg
Créez votre propre carte !,vierge,a ré8ez votre propre carte !,carte vierge,vierge/creez-votre-propre-carte-01.jpg
Créez votre propre carte !,vierge,à (oo ÉD LEE EEE LC AE © TT SRE Créez votre propre carte !,carte vierge (2e exemplaire),vierge/creez-votre-propre-carte-02.jpg
